{
  "period": {
    "start": "2099-02-13T00:00:00Z",
    "end": "2099-03-15T00:00:00Z"
  },
  "brand": "acme-cosmos",
  "platform": "twitter",
  "drama_markers": {
    "total_items": 4,
    "high_drama_count": 2,
    "medium_drama_count": 1,
    "low_drama_count": 1,
    "exclamation_rate": 0.5,
    "hype_term_rate": 0.5
  },
  "archetype_distribution": [
    { "code": "HOW_TO",          "own_count": 2, "competitor_count": 2 },
    { "code": "SKY_TONIGHT",     "own_count": 1, "competitor_count": 0 },
    { "code": "THESIS_OR_RECEIPT","own_count": 1, "competitor_count": 0 },
    { "code": "SCARCITY_FOMO",   "own_count": 0, "competitor_count": 1 },
    { "code": "TEASER",          "own_count": 0, "competitor_count": 1 }
  ],
  "hook_signals": {
    "total_items": 4,
    "top_patterns": [
      { "pattern": "how-to-numbered", "count": 2 },
      { "pattern": "announcement-breaking", "count": 1 },
      { "pattern": "direct-tip",       "count": 1 }
    ]
  },
  "cadence_profile": {
    "total_items": 4,
    "avg_posts_per_week": 1.3,
    "thread_rate": 0.0,
    "media_rate": 0.0,
    "top_days": ["wed", "sat", "tue"]
  },
  "engagement_profile": {
    "metric": "bookmarks",
    "median_value": 249,
    "high_engagement_archetype_codes": ["HOW_TO", "THESIS_OR_RECEIPT"]
  },
  "drama_signal": "high",
  "confidence": 0.62,
  "freshness_window": {
    "duration": "P30D",
    "expires_at": "2099-04-14T00:00:00Z"
  },
  "provenance": {
    "trust_zone": "U",
    "method": "manual",
    "submitted_at": "2099-03-15T08:00:00Z",
    "corpus_item_count": 8
  }
}
